id,name.local,name.en,name.slug,code.id,zip_codes,geo.lat,geo.lon
0401201,အလယ်ဘို ကျေးရွာအုပ်စု,Ah Lel Bo Village Tract,ah-lel-bo-village-tract-0401201,0401201,0401201,,
0401200,အိုင်ကြီးကုန်း ကျေးရွာအုပ်စု,Aing Gyi Kone Village Tract,aing-gyi-kone-village-tract-0401200,0401200,0401200,,
0401013,အောင်ချမ်းသာ ရပ်ကွက်,Aung Chan Thar Quarter,aung-chan-thar-quarter-0401013,0401013,0401013,,
0401014,အောင်မင်္ဂလာ ရပ်ကွက်,Aung Min Ga Lar Quarter,aung-min-ga-lar-quarter-0401014,0401014,0401014,,
0401015,အောင်မေတ္တာ ရပ်ကွက်,Aung Myit Tar Quarter,aung-myit-tar-quarter-0401015,0401015,0401015,,
0401016,အောင်စေတနာ ရပ်ကွက်,Aung Say Ta Nar Quarter,aung-say-ta-nar-quarter-0401016,0401016,0401016,,
0401012,အောင်ရတနာ ရပ်ကွက်,Aung Ya Da Nar Quarter,aung-ya-da-nar-quarter-0401012,0401012,0401012,,
0401203,ဒဟတ်ကန် ကျေးရွာအုပ်စု,Da Hat Kan Village Tract,da-hat-kan-village-tract-0401203,0401203,0401203,,
0401260,ဂျိုးကြာကန် ကျေးရွာအုပ်စု,Gyoe Gyar Kan Village Tract,gyoe-gyar-kan-village-tract-0401260,0401260,0401260,,
0401204,ဂျုတ်ကုန်း ကျေးရွာအုပ်စု,Gyoke Kone Village Tract,gyoke-kone-village-tract-0401204,0401204,0401204,,
0401235,ဘုရားကုန်း ကျေးရွာအုပ်စု,Hpa Yar Kone Village Tract,hpa-yar-kone-village-tract-0401235,0401235,0401235,,
0401234,ဘုရားပြို ကျေးရွာအုပ်စု,Hpa Yar Pyo Village Tract,hpa-yar-pyo-village-tract-0401234,0401234,0401234,,
0401238,ဖိုးလေးလုံး ကျေးရွာအုပ်စု,Hpoe Lay Lone Village Tract,hpoe-lay-lone-village-tract-0401238,0401238,0401238,,
0401237,ဖုတ်ကုန်း ကျေးရွာအုပ်စု,Hpoke Kone Village Tract,hpoke-kone-village-tract-0401237,0401237,0401237,,
0401002,ဆုံ ရပ်ကွက်,Hson Quarter,hson-quarter-0401002,0401002,0401002,,
0401205,အင်တိုင်းကြီး ကျေးရွာအုပ်စု,In Taing Gyi Village Tract,in-taing-gyi-village-tract-0401205,0401205,0401205,,
0401206,ကန်ပြား ကျေးရွာအုပ်စု,Kan Pyar Village Tract,kan-pyar-village-tract-0401206,0401206,0401206,,
0401207,ကန်တော် ကျေးရွာအုပ်စု,Kan Taw Village Tract,kan-taw-village-tract-0401207,0401207,0401207,,
0401208,ကံသာကြီး ကျေးရွာအုပ်စု,Kan Thar Gyi Village Tract,kan-thar-gyi-village-tract-0401208,0401208,0401208,,
0401010,ကန်သာ ရပ်ကွက်,Kan Thar Quarter,kan-thar-quarter-0401010,0401010,0401010,,
0401209,ကရင် ကျေးရွာအုပ်စု,Kayin Village Tract,kayin-village-tract-0401209,0401209,0401209,,
0401210,ကွမ်းအုံ ကျေးရွာအုပ်စု,Kun Ohn Village Tract,kun-ohn-village-tract-0401210,0401210,0401210,,
0401259,ကြာကန် ကျေးရွာအုပ်စု,Kyar Kan Village Tract,kyar-kan-village-tract-0401259,0401259,0401259,,
0401211,ကျစ်စုံပွေး ကျေးရွာအုပ်စု,Kyit Son Pway Village Tract,kyit-son-pway-village-tract-0401211,0401211,0401211,,
0401212,ကျွန်းပြတ် ကျေးရွာအုပ်စု,Kyun Pyat Village Tract,kyun-pyat-village-tract-0401212,0401212,0401212,,
0401214,လပ်ပတော ကျေးရွာအုပ်စု,Lat Pa Taw Village Tract,lat-pa-taw-village-tract-0401214,0401214,0401214,,
0401217,လယ်ယား ကျေးရွာအုပ်စု,Lel Yar Village Tract,lel-yar-village-tract-0401217,0401217,0401217,,
0401213,လက်ပုတို ကျေးရွာအုပ်စု,Let Pu To Village Tract,let-pu-to-village-tract-0401213,0401213,0401213,,
0401215,လင့်မြင့် ကျေးရွာအုပ်စု,Lint Myint Village Tract,lint-myint-village-tract-0401215,0401215,0401215,,
0401216,မကြီးခြေတောက် ကျေးရွာအုပ်စု,Ma Gyi Chay Htauk Village Tract,ma-gyi-chay-htauk-village-tract-0401216,0401216,0401216,,
0401220,မကြီးကန် ကျေးရွာအုပ်စု,Ma Gyi Kan Village Tract,ma-gyi-kan-village-tract-0401220,0401220,0401220,,
0401219,မယ်လှတောင် ကျေးရွာအုပ်စု,Mei Hla Taung Village Tract,mei-hla-taung-village-tract-0401219,0401219,0401219,,
0401218,မိကျောင်းရဲ ကျေးရွာအုပ်စု,Mi Kyaung Ye Village Tract,mi-kyaung-ye-village-tract-0401218,0401218,0401218,,
0401009,မင်းကံကြီး ရပ်ကွက်,Min Kan Gyi Quarter,min-kan-gyi-quarter-0401009,0401009,0401009,,
0401248,မင်း ကျေးရွာအုပ်စု,Min Village Tract,min-village-tract-0401248,0401248,0401248,,
0401222,မြေနု ကျေးရွာအုပ်စု,Myay Nu Village Tract,myay-nu-village-tract-0401222,0401222,0401222,,
0401223,မြင်ကွန်း ကျေးရွာအုပ်စု,Myin Kun Village Tract,myin-kun-village-tract-0401223,0401223,0401223,,
0401224,မြင်းစိုင်း ကျေးရွာအုပ်စု,Myin Saing Village Tract,myin-saing-village-tract-0401224,0401224,0401224,,
0401011,မြင်သာ ရပ်ကွက်,Myin Thar Quarter,myin-thar-quarter-0401011,0401011,0401011,,
0401252,မြစ်နားသာစည် ကျေးရွာအုပ်စု,Myit Nar Thar Si Village Tract,myit-nar-thar-si-village-tract-0401252,0401252,0401252,,
0401001,မြို့ဟောင်း ရပ်ကွက်,Myo Haung Quarter,myo-haung-quarter-0401001,0401001,0401001,,
0401004,မြို့မအိုးဘို ရပ်ကွက်,Myo Ma Oe Bo Quarter,myo-ma-oe-bo-quarter-0401004,0401004,0401004,,
0401225,နံကပ်ကျွန်း ကျေးရွာအုပ်စု,Nan Kat Kyun Village Tract,nan-kat-kyun-village-tract-0401225,0401225,0401225,,
0401226,နတ်ကန် ကျေးရွာအုပ်စု,Nat Kan Village Tract,nat-kan-village-tract-0401226,0401226,0401226,,
0401227,ငါးဆောင် ကျေးရွာအုပ်စု,Ngar Saung Village Tract,ngar-saung-village-tract-0401227,0401227,0401227,,
0401229,ညောင်ကံ ကျေးရွာအုပ်စု,Nyaung Kan Village Tract,nyaung-kan-village-tract-0401229,0401229,0401229,,
0401230,ညောင်ကြပ်စမ်း ကျေးရွာအုပ်စု,Nyaung Kyat San Village Tract,nyaung-kyat-san-village-tract-0401230,0401230,0401230,,
0401228,ညောင်ပင် ကျေးရွာအုပ်စု,Nyaung Pin Village Tract,nyaung-pin-village-tract-0401228,0401228,0401228,,
0401231,အုန်းတွဲ ကျေးရွာအုပ်စု,Ohn Twe Village Tract,ohn-twe-village-tract-0401231,0401231,0401231,,
0401232,ပဌနဂို ကျေးရွာအုပ်စု,Pat Hta Na Go Village Tract,pat-hta-na-go-village-tract-0401232,0401232,0401232,,
0401236,ပေပင်စမ်း ကျေးရွာအုပ်စု,Pay Pin San Village Tract,pay-pin-san-village-tract-0401236,0401236,0401236,,
0401233,ပုထိုး ကျေးရွာအုပ်စု,Pu Htoe Village Tract,pu-htoe-village-tract-0401233,0401233,0401233,,
0401008,ပြည်တော်သာ ရပ်ကွက်,Pyi Taw Thar Quarter,pyi-taw-thar-quarter-0401008,0401008,0401008,,
0401240,စမ်းမကြီး ကျေးရွာအုပ်စု,San Ma Gyi Village Tract,san-ma-gyi-village-tract-0401240,0401240,0401240,,
0401005,ဆားရွှေကင်း ရပ်ကွက်,Sar Shwe Kin Quarter,sar-shwe-kin-quarter-0401005,0401005,0401005,,
0401239,ဆားတိုင်ကံ ကျေးရွာအုပ်စု,Sar Taing Kan Village Tract,sar-taing-kan-village-tract-0401239,0401239,0401239,,
0401241,ရှားပင်လှ ကျေးရွာအုပ်စု,Shar Pin Hla Village Tract,shar-pin-hla-village-tract-0401241,0401241,0401241,,
0401242,ရှားစောင်းကံ ကျေးရွာအုပ်စု,Shar Saung Kan Village Tract,shar-saung-kan-village-tract-0401242,0401242,0401242,,
0401017,စိုးကောမင်း ရပ်ကွက်,Soe Kaw Min Quarter,soe-kaw-min-quarter-0401017,0401017,0401017,,
0401244,ဆူးကောက်စမ်း ကျေးရွာအုပ်စု,Su Kauk San Village Tract,su-kauk-san-village-tract-0401244,0401244,0401244,,
0401243,ဆူးပြစ်စမ်း ကျေးရွာအုပ်စု,Su Pyit San Village Tract,su-pyit-san-village-tract-0401243,0401243,0401243,,
0401245,တပေါက်တော ကျေးရွာအုပ်စု,Ta Pauk Taw Village Tract,ta-pauk-taw-village-tract-0401245,0401245,0401245,,
0401246,တပ်ကုန်း ကျေးရွာအုပ်စု,Tat Kone Village Tract,tat-kone-village-tract-0401246,0401246,0401246,,
0401247,တောင်ခွင် ကျေးရွာအုပ်စု,Taung Khwin Village Tract,taung-khwin-village-tract-0401247,0401247,0401247,,
0401249,တယ်ပင်ကံပေါက် ကျေးရွာအုပ်စု,Tei Pin Kan Pauk Village Tract,tei-pin-kan-pauk-village-tract-0401249,0401249,0401249,,
0401250,သမန်းတော ကျေးရွာအုပ်စု,Tha Man Taw Village Tract,tha-man-taw-village-tract-0401250,0401250,0401250,,
0401221,သပြေစမ်း ကျေးရွာအုပ်စု,Tha Pyay San Village Tract,tha-pyay-san-village-tract-0401221,0401221,0401221,,
0401251,သရက်လေးပင် ကျေးရွာအုပ်စု,Tha Yet Lay Pin Village Tract,tha-yet-lay-pin-village-tract-0401251,0401251,0401251,,
0401007,သိင်္ဂါဂီရိ ရပ်ကွက်,Thein Gar Gi Ri Quarter,thein-gar-gi-ri-quarter-0401007,0401007,0401007,,
0401258,သက်ရင်းတော ကျေးရွာအုပ်စု,Thet Yin Taw Village Tract,thet-yin-taw-village-tract-0401258,0401258,0401258,,
0401202,သစ်ရာကောက် ကျေးရွာအုပ်စု,Thit Yar Kauk Village Tract,thit-yar-kauk-village-tract-0401202,0401202,0401202,,
0401253,ယင်းနားဂွေးချောင်း ကျေးရွာအုပ်စု,Yin Nar Gway Chaung Village Tract,yin-nar-gway-chaung-village-tract-0401253,0401253,0401253,,
0401254,ယင်းနားသာစည် (အရှေ့) ကျေးရွာအုပ်စု,Yin Nar Thar Si (East) Village Tract,yin-nar-thar-si-east-village-tract-0401254,0401254,0401254,,
0401255,ရွာဟောင်းကန် ကျေးရွာအုပ်စု,Ywar Haung Kan Village Tract,ywar-haung-kan-village-tract-0401255,0401255,0401255,,
0401256,ရွာသာ ကျေးရွာအုပ်စု,Ywar Thar Village Tract,ywar-thar-village-tract-0401256,0401256,0401256,,
0401006,ရွာသစ်ပွဲကြို ရပ်ကွက်,Ywar Thit Pwe Kyo Quarter,ywar-thit-pwe-kyo-quarter-0401006,0401006,0401006,,
0401003,ဈေးလယ်စိုး ရပ်ကွက်,Zay Lel Soe Quarter,zay-lel-soe-quarter-0401003,0401003,0401003,,
0401257,ဇီးကျွန်း ကျေးရွာအုပ်စု,Zee Kyun Village Tract,zee-kyun-village-tract-0401257,0401257,0401257,,
